cppsrc/gomoku_opencl_tuning
0;XgemmBatched;48;64;48;16; -DKWG=32 -DKWI=2 -DMDIMA=8 -DMDIMC=8 -DMWG=32 -DNDIMB=16 -DNDIMC=16 -DNWG=64 -DSA=1 -DSB=1 -DSTRM=0 -DSTRN=0 -DVWM=4 -DVWN=2;OpenCL: NVIDIA Corporation GeForce GTX 1050 Ti @ 1620MHz
