cppsrc/NN/gomoku_opencl_tuning
0;XgemmBatched;32;16;32;16; -DKWG=32 -DKWI=2 -DMDIMA=16 -DMDIMC=16 -DMWG=32 -DNDIMB=8 -DNDIMC=8 -DNWG=16 -DSA=1 -DSB=1 -DSTRM=0 -DSTRN=0 -DVWM=2 -DVWN=2;OpenCL: NVIDIA Corporation GeForce GTX 1050 Ti @ 1620MHz
